Store_locations_ID,Text_ID,Text,aspectCategory,sentiment
1,2,very valuable for the service he provides the products and their quality,service,positive
1,3,i entered this caf but did not sit down due to an emergency but it is considered a good place for young groups,place,positive
1,4,the place is beautiful and elegant but there are annoying smells during the sessions,place,positive
1,5,the sessions are very old and worn out requests are normal and not up to par with the area,place,negative
1,6,the place is quiet on thursday and friday it is riyals for internal sessions including requests and external upon request but a cup of tea costs riyals,place,positive
1,7,the place does not provide food or food only drinks and some types of sweets,"drinks, place","positive, positive"
1,8,if there was less than one star i would have given them a session for we ordered molasses pots of tea and juice the tea is bad we dont drink it and molasses is not the last time i come,food,negative
1,9,one star is for workers only as for the prices it is tourist prices and it is small in size and expensive i do not recommend trying it,price,positive
1,10,the place is beautiful but the tv and music are loud,"ambience, place","positive, positive"
1,11,the place is amazing but for the first time i know that it is reserved for big matches or classics but it is a good place with parking but it is tight,place,positive
1,13,the place is untidy and not clean and the prices are very very high for the filth burnt sofas and nonexistent floors pepsi is only riyals you are sitting in the most luxurious restaurant in jeddah and shisha is riyals compared to the cleanest most luxurious and tidy place nearby for only a kilo parallel world for riyals a medical device of the luxury type is compared to this caf that brings you the cheapest type of cheap medical equipment that is a riyal and those who run the caf are disgustingly barbaric there is a lack of politeness from an employee mona i know she is saudi or ethiopian she is happy but she does not understand how to deal with customers,"clean, place","positive, positive"
1,15,a dirty place burnt seats and exaggerated prices double the price of a luxury cafe on the sea i dont know what the situation is a commercial coverup of africans bringing their cousin to run the caf the situation is reported to the ministry of commerce and the municipality,place,negative
1,16,look at the prices of having a hookah in burj al arab or sitting by the sea it is better for a pepsi for riyals and a shisha for riyals and finishes in minutes  any place run by haboush this is the end of it,"price, food","positive, positive"
1,18,good place but a little noisy,place,positive
1,19,i do not recommend it and its prices are more expensive,price,positive
1,20,a good cafe with comfortable floor seating,seating,positive
1,23,excellent but drinks from outside are prohibited let me pay for the seat but i can drink as much as i want,drinks,positive
1,24,what do they show in the italian league cleanliness is yours beloved,clean,positive
1,28,god willing the place is beautiful the seating is comfortable and the prices are good i advise you on the saffron cake and arabic coffee something else,"price, place","positive, positive"
1,29,the location is very quiet but their prices are expensive,location,positive
1,30,the mongoose is slaughtered and the quality of the television is yours,food,positive
1,31,the sessions are very good and their prices are good they have hot drinks such as moroccan tea which they prepare for you once what they work in is people with good morals i swear,"price, drinks","positive, positive"
1,32,quiet and sweet place,place,positive
1,34,the best caf in north obhurexcellent sweets and drinks delivery service to the restaurants below as well as very elegant molasses the prices are acceptable and the service is excellent,"service, price","positive, positive"
1,35,good but the prices are a little high,price,positive
1,36,the coffee and tea are bad the employee is excellent and her manner of dealing is sophisticated,staff,positive
1,38,i do not recommend visiting it,place,positive
1,39,i swear we paid riyals and we dont have honey and the sweet is not worth a riyal the sweet is frozen in the freezer and i tell him to go back and heat it and nothing has any taste and does not even deserve a star,price,negative
1,40,the place is bad and the prices are very high the sessions are only with orders of more than and all the orders are expensive a cup of tea for it was an experience for the first time and the last time,price,negative
1,41,enough is bad smelly and unclean while the workers are better helpful and expensive the session costs riyals and shahis refrigerator costs until the match if there are two matches at the same time he tells you halftime they cannot buy a second receiver,clean,positive
1,42,the cafe is bad in the past it was excellent but now it has bad service and the workers have bad morals i do not recommend it there is a bad smell in the place and the furniture is old and torn and it smells damp,location,negative
1,43,what is more the screen quality is poor for matches,ambience,negative
1,44,popular coffee for young people for shisha balouh and tea i do not advise families to go,drinks,positive
1,45,unclean place and bad service i ordered hot chocolate one of the worst drinks and expensive prices i do not recommend it to anyone,"price, place","negative, negative"
1,46,they are nice but their prices are very expensive,price,positive
1,48,they force you to pay riyals for the session in the weekend,price,negative
1,49,somewhere that cares about customers never with bad service,service,positive
1,50,i think from my point of view that the place is intended for young people it is excellent for small groups of young people meaning six people is a lot the place is a bit hot and i do not recommend it for families,place,positive
1,52,good for youth sessions,"ambience, place","positive, positive"
1,53,the session is and it is not worth it to be honest many bad things happen if i pay i will go to better places,place,positive
1,54,bad place worse cleanliness bad shisha and high prices compared to the service and place,place,negative
1,55,unfortunately the molasses became very bad we visited twice and changed the hookah and it still had an unusual flavour,food,negative
1,56,honey is riyals and an espresso coffee is honestly the price is not worth all of it neither the honey nor the coffee,price,positive
1,57,sessions are useful for groups,ambience,positive
1,59,good fast service but their prices are expensive,service,positive
1,60,it is beautiful and the workers there have beautiful morals,"service, staff","positive, positive"
1,61,the prices are exaggerated and if you order dinner they force you to drink from them the price of a can of pepsi is riyals this is foolishness and greed,price,negative
1,62,my evaluation of the place is very excellent and i thank their employee with all my heart iman yasser and aseeb it was an enjoyable experience and i advise you to try the place  mrs nour qassem,place,positive
1,63,i put a star because i dont like shisha i went to watch the real madrid match entry is free a cup of tea for teapot,food,positive
1,64,beautiful session and excellent service,service,positive
1,65,a wonderful cafe but please provide a contact number for customers who need advance reservations,place,positive
1,67,the place is quiet and beautiful their sweets are delicious but their flaw is that the prices are completely unreasonable a cup of tea costs riyals a small refrigerator costs riyals and juices start at riyals in small cups,"price, place","positive, positive"
1,68,the session is special and the service is excellent,service,positive
1,69,very excellent service but the price of the molasses is exaggerated,"service, price","positive, positive"
1,70,the thing i liked about it is the floor sitting,ambience,positive
1,72,i tried more than one order from them and the food was the employees treatment is excellent,staff,positive
1,73,tuna sandwich cortado ice cream quinoa salad,food,positive
1,74,i expect they need to pay attention to the expiration date of the food because more than once the salad smells spoiled and the last time i bought juice and as soon as i got home i opened it and it turned out spoiled despite the expiration date having more than a day left,food,negative
1,75,the shop is nice the staff are nice and the beef burger is delicious,"staff, food","positive, positive"
1,76,the restaurant is excellent and has many options especially for those suffering from celiac disease gluten allergy its prices are in exchange for the quality and taste it is very excellent and the food is healthy and good thank you,price,positive
1,78,i took the white mocha ice chicken and it tasted bitter but i didnt like it,food,negative
1,79,classy treatment from the supervisor hussein mahmoud clean food tidy place and excellent honesty branch,place,positive
1,80,a beautiful experience a special branch that gives them wellbeing,service,positive
1,83,the place is nice beautiful clean and tidy real out of,place,positive
1,85,they were always treated well and of course especially brother rakan and brother hussein may god grant them success and sustenance,service,positive
1,86,their dishes are delicious and healthy i ordered a very delicious caesar lab sandwich hummus with amazing beetroot and delicious chicken pasta with sauce,food,positive
1,88,mashallah god bless you the burger is very excellent and the dealings are professional especially the employee rafi i strongly advise you,staff,positive
1,89,honestly the worker who works is elegant and keeps you informed,service,positive
1,91,the food is good their coffee is bad,food,negative
1,92,a wonderful place for those who love healthy clean food with delicious taste and reasonable prices,"price, place","positive, positive"
1,93,when do you provide coffee today or an americano filter because coffee without a filter tastes bad i hope you will address the problem that has been going on for more than a month,"service, drinks","positive, positive"
1,97,their business lunch experience is dangerous and they offer a fried or grilled chicken or meat burger meal with fries and a drink for riyals which is very excellent,food,positive
1,99,the place was nice once i sat in it from after the fajr prayer until noon it was once comfortable and the time was insensible i loved the calm the music and the food was good and the dessert was their due it was also nice i loved it,dessert,positive
1,100,a very good restaurant and the staff are distinguished respectful and ethical,staff,positive
1,101,i took it from them cold coffee ie chicken white mocha taste i had a hot coffee cappuccino i found they have a box of dessert filled with ice cream of course three flavors of filling pistachio vanilla and chocolate i cant describe the taste its price is approximately but it is worth the taste they have delicious salads and sandwiches with different fillings including chicken and cheese honestly you will be confused most importantly of all the service is excellent and the one in the cashier whose name i dont know is khadoum murra may god make him happy to serve with compassion for those like him and the place is nice in the morning,price,positive
1,102,i ordered basil pasta and the microwave did not heat up like the world but people left it and walked away may god continue the blessing,food,positive
1,103,i tried their grilled meat burger which was very tasty and filling now i find it to be the best and the potatoes were delicious i liked it,food,positive
1,104,delicious clean selfservice and healthy food,service,positive
1,105,worker ethics are poor,staff,negative
1,106,i came by chance wanting a collection box and got it i bought a coffee box with six cold coffees in it but i didnt take a picture of the box but its adorable and i missed taking a picture of itthe one at the cashier is smart and respectable i commented on his work and he responded to my inquiries with kindness and was not displeased with my comments may god make him happy this is the first time i try them but god willing their work is tidy and clean,staff,positive
1,108,a good place may god bless everyone,place,positive
1,109,their coffee is delicious there was a coffee presentation with cookies and the employees behavior was wonderful,"service, staff","positive, positive"
1,110,i visited the branch more than once honestly i find zed to be a good option for snacks especially salads  i tried more than one type of their sweets and most of them were too sweet,food,positive
1,111,wonderful excellent welcoming and cooperative service from employee soha,staff,positive
1,112,cold is crazy but hot means its not bitter and sweet,drinks,negative
1,113,i ordered specialty coffee and it was amazing i thank the staff,staff,positive
1,114,clean food high prices,"price, food","positive, positive"
1,115,as for the coffee it is very bad i tried the flat white and spanish latte the flat white latte was bad once unfortunately i threw it away it had a strange taste like cardboard and spanish you are okay,drinks,negative
1,116,healthy and delicious food and a variety of options from salads juices burgers sandwiches and coffee the advantage is that it is open hours a day breakfast lunch and dinner satisfy all tastes at all times,food,positive
1,119,egg scramble with bacon is the best thing i have ever tasted for breakfast and the tuna sandwich is delicious,food,positive
1,120,the chicken burger is delicious the sandwiches are light and there is no milk dessert god willing other than chocolate dessert the ice creams too to be honest everything is excellent even the service and staff,"service, food","positive, positive"
1,121,the visit was for breakfast the egg sandwich with bacon was good but the bacon was only a little bit at the beginning of the sandwich the prices are fairly good the other items are good,"price, food","positive, positive"
1,122,i loved it they had an offer tomorrow i got a delicious salad from them,food,positive
1,124,banana cake is delicious and light,dessert,positive
1,125,a nice small place their salads are delicious the staff is excellent and their prices are very reasonable,"place, staff, food","positive, positive, positive"
1,126,honestly what attracted me to this place was the behavior of the staff the cleanliness of the place and the interest in serving coffee,place,positive
1,127,a beautiful and quiet place their breakfast is great and their coffee is delicious,place,positive
1,128,zed of course needs no introduction but the quality of the lettuce burger has changed the meat has become thinner the lettuce is more and the sauce is more it did not suit me to be honest and it was not the first time i had tried it but in the past it was better,food,positive
1,129,the place is elegant and there is a variety of drinks and healthy food,"ambience, place, food","positive, positive, positive"
1,130,they have sweet burgers coffee and salads,food,positive
1,131,the food is not up to par sandwiches and burgers in pictures are the opposite of reality very small and not worth the price,"price, food","positive, positive"
1,132,a wonderful place very clean excellent service a cheerful reception a professional explanation of the products and a variety of menu and choices ,place,positive
1,133,the place is nice but the food is never up to par the food in the pictures is the opposite of reality and they serve it to you cold,"service, place, food","positive, positive, positive"
1,134,my favorite place i used to go to the branch in alnaeem and i visited this branch with a pleasant smile and the treatment was wonderful,"service, place","positive, positive"
1,135,the food is not clean i found an ant with sweet potatoes i hope you take care of the cleanliness of the kitchen not just the cleanliness of the decor,clean,positive
1,137,their salads are excellent the quality of the ingredients is high  the caesar is delicious the sauce tastes great the vegetables are fresh the chicken is clean and delicious and it has no smell at all the tuna sandwich is delicious but bitter and sour chicken shawarma in tortilla bread the chicken is marinated with a slightly sour seasoning and the garlic taste is very overpowering as for myself i like them to be light i strongly advise the authorities,food,positive
1,138,the employees treatment of the cashier is excellent let her continue with the same treatment every time she visits again,staff,positive
1,139,they have dangerous spanish,ambience,negative
1,140,it was our lunch today and everyone who ate the salad now suffers from severe cramps and fever something unreasonable,food,negative
1,141,great but the prices are a little high,price,positive
1,143,god willing the place is excellent i loved having an employee with the utmost respect and a beautiful manner alghamdi also i will not forget the cashier sister  mashallah,"place, staff","positive, positive"
1,144,bad service high quality tasty,service,negative
1,145,excellent location and wonderful service we thank them the store has mixed salads fresh juice ice cream and healthy sandwiches that are frankly delicious there are seating sessions if you want to eat in the place,location,positive
1,146,once upon a time it was nice and quiet,ambience,positive
1,147,amendment the coffee that forces you to come back for it is excellent coffee delicious sandwiches and their salads are amazing and what sets them apart is their very very excellent prices  their place is nice and has a variety of food but i did not like the way the cashier behaved he was sitting taking my order and at the same time he was busy joking around and talking to another customer who seemed to know him and had no focus his method was unprofessional,staff,positive
1,149,the best branch and the branch in which i feel most calm and comfortable the branchs design reflects the atmosphere of the coffee as well as the sessions are good the employee fatima is very very respectful and professional in her work she is cheerful and literally makes your day before you order and the coffee completes what is missing,staff,positive
1,151,frankly speaking the employee fatima is very respectful and has a nice reception of customers she always makes my coffee the way i like it may god bless her,service,positive
1,152,the wonderful place the coffee and the barista in the coffee shop thank you for their sophistication on the founding day i took an americano and a cortado i liked the pictures they chose on the cups they are very beautiful and the taste of the coffee is balanced bravo,"drinks, place","positive, positive"
1,153,the employee fatima is very polite and has a nice attitude,service,positive
1,154,the employees at the barneys branch north obhur alshiraa district are very wonderful paper handling and service,service,positive
1,155,everything was invalid except for the presence of only one employee and the delay in orders because of that,staff,negative
1,158,i ordered their croissant and it was bitesized and hard to chew old pine,food,negative
1,159,the employee fatima maksab at the northern obhur branch may god make her happy sip me a cup of coffee mixed with the brain other than cheerfulness and tact she feels comfortable in the place,place,positive
1,160,i ordered from the application long shot white mocha ice chicken i wrote more than once to add extra ice unfortunately the order arrived without any piece of ice and on top of that it arrived warm without any cold because as usual the milk is not cold i am a fan of barnes but i repeat the same behavior more than once the milk is not cold unfortunately i have become hesitant about ordering from you i hope you read my comment and do not ignore it as they ignore customer reviews in the application,service,negative
1,167,i love turkish coffee barneys the cheerful employees like the employee fatima asal love the place and her service is great,service,positive
1,168,i ordered from the application and it looks like you are fine the order did not arrive before the representative did not arrive in a long time it was cold and the cream was not available they did not even put the chocolate powder on top unfortunately there is no professionalism,staff,positive
1,169,the branch is wonderful  my favorite,food,positive
1,172,i enjoyed visiting the branch and the cheerfulness and good behavior of the staff fatima and uddhnb thank you,staff,positive
1,177,there is no discussion about the quality of barneys and as for the employee fatima she is one of the best and kindest employees god willing for her service may god grant her success,"service, staff","positive, positive"
1,178,i received the site inside the complex and i kept feeling and feeling the last thing i saw after hyper panda,location,positive
1,179,the star is for the comment only i waited for about minutes just to order knowing that there was only one customer in front of me and it is clear that the barista made the coffee without breathing and the coffee making place was full of flies and the barista hit himself with his hand and continued making the coffee normally  as for regarding the sessions leave your comment,"place, staff","positive, positive"
1,180,a fan of barneys the service is excellent,service,positive
1,181,very good service and i thank the management carefully for choosing the employees and the branch manager,"service, staff","positive, positive"
1,182,excellent service respectful staff,"service, staff","positive, positive"
1,183,i came to them this morning and their coffee was very delicious,"drinks, food","positive, positive"
1,185,the saudi employee zabal ok dealt with the pressure today with the international coffee offer but he has no right to treat us like this,staff,positive
1,186,it is very small and dirty there is no attention to cleanliness and all the tables have empty or halffilled drinks and no one is sitting at the table and the floors have drinks spilled on them and the condition of the store is impeccable,clean,negative
1,187,why is the backrest so high this session is uncomfortable,seating,negative
1,188,because of the deal where there is only one worker and there is no interest in the customer,service,positive
1,189,from experience the best taste of turkish coffee you can taste frankly is at barneys i would like to thank the employees in the branch very much for their sophisticated and distinguished treatment of honesty we hope that the branchs outdoor tables and chairs will be improved,staff,positive
1,190,excellent branch great staff and the coffee quality is always good,staff,positive
1,191,the service is excellent and the team god willing is respectful and the quality is respectable all thanks to them,service,positive
1,194,i want to give them three stars because they dont have mocha slush,"drinks, food","positive, positive"
1,195,barneys is the same miser in humor there was a miserly man who told his family if you succeed he will bring you a ball when they succeeded he brought them a ball that did not contain any air and told them if you succeed a second time i will give you air barneys put wifi in the branch but they dont give you the password you cant operate a laptop on it the problem is that the name of the network is guest barns i mean we brought you the network but we dont give you the wifi number its forbidden this is one of the strangest things that has happened to me in my life and no one told me that it was an individual error on the part of the employees because i called customer service and they told me verbatim that it is forbidden to give out the wifi number the employees are not at fault these are their management instructions responsible for customer experience at barneys i advise you to submit your resignation as a mark of disgrace on you this is not only a matter in the company in your entire professional history one of our morals as saudis is generosity to everyone and our saudi companies reflect our morals and bernayss politics completely reflect our morals if this continues i guarantee you that it will disappear from the market within the next five years starbucks is just a minute away from the barneys branch i mean your competitor starbucks is a minute away from the branch and you act like this let us calculate it with you as a customer i ordered from barneys now for riyals and i bring a laptop with me to work and i often sit between two and three hours ordering in about two to three orders the average cost is riyals i was surprised that they are forbidden to give me the wifi number but only by barcode and the barcode does not work on the laptop but on the mobile phone when i saw this thing i went to starbucks which is a minute away to finish my work and i definitely wont order from them again how much did barneys lose then riyals immediately when i left the branch if we say that i work days a week in a caf at an average cost of riyals per week and monthly riyals i mean barneys lost to one person a realized loss of from the customers basket instead of the customer paying riyals he paid riyals because he did not sit down one week he lost of the customers basket he lost of the customers basket every month responsible for customer experience at barneys listen to my advice and submit your resignation and find yourself a second career,staff,negative
1,197,airconditioned outdoor seating and balanced coffee,seating,positive
1,203,one of the saudi brands that we are proud of is specialized coffee competitive prices high quality and beautiful decor it is a permanent and distinguished option and the reality of the idea of expanding it and transforming from kiosks into wonderful coffee shops i used to say that if he improves it it will spread more and more progress and success,price,positive
1,204,awesome place but why is there no lid for the cup size,place,positive
