Store_locations_ID,Text_ID,Text,aspectCategory,sentiment
22,5191,very bad service imagine five of us we entered and sat down at the table what do you order we ordered honey the one who ordered juice and the one who ordered coffee said whoever ordered honey must ask for juice i told him i dont want it we closed at the table we have to order i told him okay you can go and come we think he says think and he sits down to debate with us like cats you have a bad manner you speak to him with respect he speaks in his language as if he is taking revenge on us i dont know whether we are his customers or his enemies what is our concern the important thing is that i informed the caf owner about him and his treatment and their prices frankly i will spare my head for i hope the shop owner sees the message check with your employees and follow them your rating is on google if the employees continue to deal with this erasing increases your disdain for customers,"service, place","positive, positive"
22,5192,my experience with balcony cafe the place is excellent reception is excellent drinks and honey are more than excellent the staff are excellent and thanks also to islam and ahmed shafiq morning shift ahmed imad abu rayyan and reda the evening shift,"price, place, staff","positive, positive, positive"
22,5193,their treatment is respectful the place is good the songs are very depressing i entered happy and came out worried the molasses took five minutes and it burned which i did not like at all prices are reasonable the place is most suitable for young people,drinks,positive
22,5194,first and last i am selling the store with great work it will be next to us an elegant and excellent cafe very sweet enjoy the service and everything is excellent just a note from me and everyone who visited the cafe he blockona cafe excellent cleanliness service and quick response to requests i congratulate them very much but the question arises overpriced in everything in particular drinks and honey this is better enter with a cup of coffee from the nearest store and do not take it from the same store even a service boy but they dont exaggerate the prices,staff,negative
22,5195,very great place i am always there i watch all football matches at the local or international level a very important addition the service providers provide excellent treatment and speed in submitting your request in less than a minute i advise you to attend,"service, place","positive, positive"
22,5196,the place is excellent and the service is excellent the molasses is one of the worst that mixes the molasses it is made by a fancy student who went to something for the second time the first and last time meaning he is a regular customer i do not recommend it,clean,positive
22,5197,the place is wonderful with the winter atmosphere and the balcony seating is also creative the staffs treatment is very excellent their honey is delicious and the prices are very very reasonable visit them you will not regret it,"place, location","positive, positive"
22,5198,the first time i came to this cafe i came in the morning but there was no ventilation or air conditioning it was hot and dark the second thing i ordered was the direct cocktail juice which was mountainous with layers never not fresh these are my comments and i hope for improvement in the next visit,service,positive
22,5199,the worst caf and the worst shisha employee you will meet is the egyptian who is impolite and has no taste we left the caf and left due to his lack of politeness after the shisha and tea came out advice to the owner of the caf change it or else he will lose many customers,place,positive
22,5200,frankly speaking the place is amazing and the service is nice especially the employee abu rayyans treatment he deserves it because he has a wonderful shisha and the best honey,service,positive
22,5201,mashallah may god bless you the service and atmosphere are once again excellent everything is clean and tidy the workers are doing nothing good may god give them good health and may you find strength i wouldnt say they lack manners and respect on top of them the owner of alkafi thank you all may god grant you strength and strength to move forward god willing and his name is imad he is a respectable and brave human being there is nothing to say he has no rights he is very excellent he does not fall short in any service or request may god grant success and happiness in this world and the afterlife lord of the worlds,"place, staff","positive, positive"
22,5202,the rating is very excellent the service is excellent the dealings with imad and ahmed are excellent the place is once amazing i advise you to visit it do not miss it,service,positive
22,5203,the cafe is nice the atmosphere is wonderful and the services are excellent the molasses is excellent and has a beautiful flavor i recommend trying it and i visit them every day it deserves support,staff,positive
22,5205,frankly speaking it is one of the best places that offer high quality honey we hope to continue like this and thank them for their service,place,positive
22,5206,the best place with facilities and excellent service and the staff are amazing especially kamal,place,positive
22,5207,the service is excellent the molasses is good and imad is the best person i advise you to visit,"service, place","positive, positive"
22,5208,very adequate comfortable seating very excellent service and very respectful and sophisticated staff it is worth trying and visiting,place,positive
22,5209,today sunday i came to listen to the songs for the party and i was surprised from until all of them are introductions greetings and dedications and the gulf songs that the singer sang did not exceed and the person giving the dedications speaks more than the singer we pay to hear the dedications and not hear the concert really strange,"price, place","positive, positive"
22,5210,the place has beautiful decorations but the treatment with customers is bad and the drinks were kind of nice i hope you see i mean in dealing with customers i pay money i want highend service and service that makes me happy makes me come to the place once and twice only,place,negative
22,5211,there is literally no respect for the customer that i know you are supposed to please your customers in order for your project to succeed not alienate them literally everyone at the table must order and the moya glory be to god does not consider it an order it must be juice or anything and they sit on top of your head looking at you and the shark says as if you are going with their money not with yours very annoying other than the place very very bad,place,positive
22,5212,god willing the service is fast and the molasses is sweet the treatment is very nice from brother imad they care about the comfort of the customers the place is very beautiful,place,positive
22,5213,beautiful place and comfortable seating the drawback is that the molasses is mixed and there is no pure molasses minutes if you finish it it wont burn excellent its not worth trying unfortunately,staff,negative
22,5214,my visit to the coffee shop was on the opening day beautiful place comfortable explanation and sitting the owner of the kufi mr abdulaziz is at the place the employees both male and female thank them very much their prices are very great molasses riyals turkish coffee for riyals and it was nice it is worth the experience i wish good luck for them,place,positive
22,5215,bad bad bad there is no respect for the customer you have to order the entire menu in order for them to receive you one or two orders are not enough however the tables and chairs are bad the place is dusty and the employee sits on your head by force you order in a way and i dont know how to walk they want to force the customers in every way one star is forbidden for them,dessert,negative
22,5216,a wonderful and beautiful place with an atmosphere and people musical evenings and the choice of artists is distinguished all thanks to the work crew and thanks to the owners of the place uncle reda and professor abdul aziz and from success to success god willing,"place, staff","positive, positive"
22,5217,yesterday i went to the cafe the place is nice but it needs ventilation because the place is stuffy the second thing is that i asked for a flat and they brought me coffee all of it in foam i know that the flats are foam but i swear i,"place, staff","positive, positive"
22,5218,the egyptian employee i dont know who is one of them but his service is bad and he sits on your head order he doesnt give us time to think and he tells you that you should order as if you are running away frankly he continued with us all the time his service turned out to be bad and his attitude was bad the owner of the cafe if this employee continues you will lose customers,staff,positive
22,5219,the place is very nice comfortable and the staff are polite,service,positive
22,5220,the molasses is very bad i hope to focus on the molasses and the dessert was very bad i took the mango cake very bad its taste was clear that it had a period i would like to focus on these very important points,"service, ambience","positive, positive"
22,5221,beautiful place and atmosphere maestro omar hegazy is wonderful the staff is very welcoming and attentive,staff,positive
22,5222,the place is absolutely terrible and i advise you to visit the place the shisha is excellent and the staff are respectful and excellent,"place, staff","positive, positive"
22,5223,hello good evening everybody in fact my experience with balcona caf was by chance of course i am new to the neighborhood i entered the pharmacy to buy medicine and smelled the scent of honey i spoke to the pharmacist and he said the cafe is above us honestly the place is excellent reception is excellent drinks and honey are more than excellent the employees treatment is excellent the employees even the direct ones are treated well the owner of the caf may god bless you with his abundant bounty thanks also to ahmed the evening shift ehab ahmed alwardia morning age even the sisters thanked from the heart your brother abu ahmed,staff,positive
22,5224,the service is excellent the workers are good the best one is imad i advise you to visit,"service, staff","positive, positive"
22,5225,mashallah the cafe is classy and the service is excellent and upscale you feel comfortable and calm when you are there the food is in harmony with the atmosphere and drinks especially the shisha it tastes like an authentic melody i advise everyone to be there and visit it i hope to repeat the experience of being there again and again,staff,negative
22,5226,his sessions are comfortable and his explanations are sufficient in internal and external sessions the behavior of the staff and the employee iman is very nice even during match times and pressure they know how to handle it and the place is equipped with extra chairs and air conditioners their honey is excellent and its price is riyals i ordered cardamom juice and it was good cold mocha frankly i didnt like it there was no balance between the coffee and milk it tasted like watery milk the barista needs training but it is enough to have a mobile phonesong device because every now and then a notification comes on the mobile phone an advertisement from youtube something annoying the cafe needs numbered tables for better service i advise you frankly about it,location,positive
22,5227,their treatment is good the type of sweets is very very bad the milkshakes with strawberries and oreos are not nice the place is very nice i hope it improves for you the sweets are changed from time to time because it tastes very good it is clear that it has been there for three days and according to what the staff said the sweets have been there for days and this is a bad thing please change everything,"place, staff","positive, positive"
22,5228,their smoothie is nice and clean but i ordered a cocktail juice and it arrived layered juice same buffets same shape and cup i dont know the employees name,service,positive
22,5229,the service is good the honey is very good and the employees have high ethics,price,negative
22,5230,very bad behavior especially the egyptian worker whose name is ahmed his style is to make the customer fly away and not come back again,place,positive
22,5231,the site is good but the problem is in the ethics of officials and managers imagine you are still drinking your coffee and he comes and tells you that he wants to order and their looks are bad hahaha,price,positive
22,5232,with all honesty and accuracy the place is beautiful the way the female employees deal with them is better and more courteous than the direct employees the barista teacher his experience is very weak he is not an artist in serving hot or cold drinks he is inaccurate in the issue of balancing milk with types of coffee or ice with milk and coffee as well in short you drink flavored milk or ice with milk what is the matter i do not recommend trying coffee or a cold drink and it is not forbidden to try it once and make sure with all due respect my rating is only for the place and the employees,"price, drinks","positive, positive"
22,5233,this egyptian is so awesome his name is imad honestly he has served us at a level of service god willing keep it up,"price, place","positive, positive"
22,5234,their laundry is bad and the prices vary if they are expensive,place,positive
23,5235,frankly it is a very bad place after we sat and stayed for more than two hours the management came because of a girl who was harassing us and there was no respect for the place from the management i advise everyone not to visit it my advice to you your loved ones,price,positive
23,5236,i had breakfast with them god willing with a complete buffet and their prices were good but the sweetness was indescribable god willing,dessert,positive
23,5237,the molasses is a very expensive thing and the drink is average and similar to kayans bag and its price is high and the bill came out at for four molasses and drinks it is not the right of honey to sing and dance,service,positive
23,5238,the place is nice the service is fast and the prices are good but the shisha is not nice the honey burns quickly try to adjust the shisha and put a net between the head and the coals and the songs are sometimes loud put this and that so we can talk a little,service,negative
23,5239,the place is beautiful and their system is beautiful but their shame is that they allocate sessions for families and young people and this is a lounge and a lounge they limit you to places where you can be alone and the place where there are people is forbidden under the pretext of families this leaves the place empty throughout the week,price,positive
23,5240,expensive pass it by i came to them at and she told me riyals entry fee only it was good god willing and there was nothing in it neither art nor watermelon no she told me to put the last thing in the corner why am i lonely when you pay money they control you i left and did not pay anything after i heard their shameful conditions i do not recommend visiting it and will not visit it again,"place, food","positive, positive"
23,5241,cafe and restaurant on the second floor it has indoor and outdoor sessions on the screens if you want to watch football matches the outdoor seating is airconditioned the internal sessions frankly are full of honey i tried their sweets the cheesecake tastes delicious the love sweets are delicious and the cookies are delicious food we ordered dynamite shrimp try it their potatoes are delicious i didnt like the tacos because they used tortillas and the chicken needed more seasoning fettuccine is also a taste try it fresh juices they celebrate your occasions and create an honest atmosphere the employees are quick to serve and respectful,"price, ambience, place","positive, positive, positive"
23,5242,it is beautiful and the service god bless the most merciful is fast and fresh the saudi coffee is amazing and the saffron cake is delicious but san sebastian was not as delicious,"service, ambience","positive, positive"
23,5244,everything is beautiful but the prices are exaggerated and it will be the last visit because of the egyptian songs all night long egyptian songs or fashionable wives songs or urgent songs i wish you would pay attention to all tastes in songs as not most of them are egyptian,price,negative
23,5245,great evening place and singing and choosing amazing artists and they have delicious food pizza and fettuccine pasta are delicious and the return is fresh,"service, ambience","positive, positive"
23,5246,an elegant and excellent place the atmosphere is nice and the prices are not expensive compared to jeddah lounges,food,positive
23,5248,the place is beautiful and elegant the decor is wonderful and the seats are clean and new not worn out orders are coming in slow the arrangement of seating lighting and screens is very appropriate,service,positive
23,5249,the best coffee without a competitor starting from the prices to the service and the quality of the types offered on the menu but they have the worst feature that most customers complain about which is the djs voice being so loud that you the person at the same table cannot hear him or even when requesting service you have to raise your voice because he hears you you can try asking the customers when they leave to talk about their problems with the djs loud voice advice try solving this problem that you think is an advantage and see the difference,place,positive
23,5250,distinctive atmosphere and service thank you to all the workers in this wonderful lounge,service,positive
23,5251,honestly the best thing about it is dj molasses is bad in every sense of the word,"service, staff","positive, positive"
23,5253,my review of it because i visited it noon rouqan quiet songs the cappuccino is excellent the spanish latte is excellent and the american latte is excellent the quality of the coffee and its taste is clear in the varieties and the black mojito is delicious the molasses are according to what they like two apples grapes and berries i loved the place the speed of service and the workers are nice according to what i was told there is noisy noise at night anyone who likes this atmosphere should try it and give it a second review my comment helped you like,staff,positive
23,5255,distinctive and wonderful service worth visiting more than once i am a regular customer of the place,"price, drinks","positive, positive"
23,5256,the sessions are very beautiful and elegant the service is excellent the drinks are delicious fast service i thank the entire lounge staff just a note the reservation was made via whatsapp and a sum was paid to reserve a specific table i was surprised when i arrived that our table was not the one that had been reserved i would never recommend watching matches there because of the commentary and lack of sound most of the time in general the place is elegant and beautiful but the problem is that parking is crowded,drinks,positive
23,5257,the lounge is nice and tidy the service before sunset is out of i thank brother walid for his service and good manners and i thank sister amani and brother ahmed for their taste in the evening i rate the service out of the smoke at night is annoying they do not have ventilation for the honeycombed place my rating for the food is out of have dj songs and are open hours i recommend visiting them in the morning,"menu, drinks","positive, positive"
23,5258,my review after the second visit dishes i tried shrimp pasta chicken pasta pizza espresso almuassal the place is very large and can accommodate approximately people there are only two bathrooms which are shared between visitors and employees,ambience,positive
23,5259,my experience was bad i went on january to celebrate the new year and of course the honeycomb behind me fell from someone who was passing by and my abaya and pants were burned of course every time i called someone i spoke to him and he said because we have crowding good because you have crowding that burns people by crowding,price,positive
23,5260,my experience with daily cup the coffee was delicious and the price was very nice we took two coffees for riyals each black coffee hot and cold but im thinking of trying their sweets but its cold out next time god willing ill taste it,price,positive
23,5261,this is the first time i tried hibiscus in my life and it turned out delicious hibiscus is right daily cup all people praised it for me because i liked it and it came out with praise,price,positive
23,5262,specific menu the hibiscus drink is amazing if i come to the store every day i dont have a problem the coffee is excellent ethiopian coffee magic bar brownies i havent tried the croissants but they look delicious,price,positive
23,5263,they have hibiscus god willing may god bless you and there is no mistake in the balance,price,positive
23,5264,their hibiscus is delicious and its price is considered reasonable a small one costs and a large one costs,staff,positive
23,5265,the second time i came to them my order was cold coffee and brownies excellent and delicious i swear and their price is good,price,positive
23,5266,we advised the employee of the hibiscus and cold coffee and i liked the taste honestly the quality of the taste and reasonable prices i hope the taste remains the same and the prices do not change,drinks,negative
23,5267,the experience was the first time i ordered croissants hibiscus cold coffee today dessert frankly i was shocked by the price compared to the great quality taste and speed of an experience that i recommend,staff,positive
23,5268,their coffee is delicious and affordable i hope to see them soon in our neighborhood because the prices are good,price,positive
23,5269,excellent special thanks to employee honey tasnim and his colleague othman for their morals and sweet spirit,staff,positive
23,5270,my order from them was coffee today the decor of the shop is very beautiful like their coffee but there is no local coffee and their prices are very good,price,positive
23,5271,bitter taste i once ordered cold coffee from them and bitter sweets the second time hibiscus passed it to ziz,clean,positive
23,5272,a most wonderful experience they deserve all the best especially the employee muhammad tasnim may god make him happy oh lord he did not fail with me i hope the administration honors him,price,positive
23,5273,one drink one dessert the price is unimaginable and the taste is amazing,price,positive
23,5274,the coffee is excellent but a note about the employee i asked him for a cold hibiscus and he asked what i said i was surprised after i paid that it was cold coffee and his argument was that he didnt say that then he said the hibiscus was finished in the morning and he was distracted by his mobile phone but it was a nice opportunity to try cold coffee despite the bad situation,clean,positive
23,5275,a cup of big day coffee costs approximately riyals,food,positive
23,5276,clean delicious coffee fast service excellent cleanliness and location and the price is very reasonable,price,positive
23,5277,excellent ok worth a try for the price,price,positive
23,5278,honestly their prices are very good and the coffee is good,drinks,positive
23,5279,thank them for the service cleanliness and their cold coffee edit the mood but you have a problem with the cups which cannot withstand the heat special thanks to employee fayez,dessert,positive
23,5280,hibiscus wins no mistake real and addictive,"service, price","positive, positive"
23,5281,excellent hibiscus but now the price is a little higher cold coffee i will try it soon the price is excellent,staff,positive
23,5282,a shop specializing in ethiopian coffee only for black coffee the price of a large cup exceeds riyals there are light breakfast items such as croissants with labneh it is worthy and worth a try,drinks,positive
23,5283,i was in need of coffee and i found it at that time and it saved me how refreshing and delicious cold coffee is,"price, drinks","positive, positive"
23,5285,god willing may god bless the most gracious the prices of fire and the taste of coffee are great the price is great and the jewelry is legendary i hope we see them occupy the market because they deserve it and the service is fast i strongly recommend it,price,positive
23,5286,i always come to the al nahda branch because the employee tasneem is very helpful and has good morals apart from the terrible taste of the coffee but the employee makes me happy every time i visit the branch unfortunately he moved to the al salamah branch and it is considered far from my home but for the sake of tasnim i come to the al salama branch,staff,positive
23,5288,excellent it has two advantages it is good coffee and the prices are very reasonable it is nice to get specialized coffee daily you gain value flavor and quality,"price, drinks","positive, positive"
23,5289,everything is excellent but the cups are bad the coffee gets spilled and no one stops working and i am stained and burned,drinks,positive
23,5290,hibiscus is excellent and soothing i hope you open more branches and maintain prices and quality,food,positive
23,5291,honestly even though they are opening a store every neighborhood in jeddah is beautiful the coffee is nice and the employee is very helpful keep it up god willing soon i will see you under our building,price,positive
23,5292,everything they have is excellent,price,positive
23,5293,the coffee is elegant its colors are comfortable and its prices are more reasonable the coffee concentration is excellent compared to the price and the worker is cheerful may god bless you and increase your branches,"service, price","positive, positive"
