Store_locations_ID,Text_ID,Text,aspectCategory,sentiment
11,3383,so nice to sit outside but even indoors is cozy the staff is friendly and accommodating,place,positive
11,3384,hoot is simply an amazing place to be at i would recommend this place to all family and friends with no hesitation love this place,service,negative
11,3385,love it cozy and very friendly atmosphere in this cafe the coffee and carrot cake is delicious __ __,"service, place","positive, positive"
11,3386,best place in jeddah,place,positive
11,3387,highly recommended hope to see their new branches ____,"place, staff","positive, positive"
11,3388,sorry but the waiting list is very bad cuz of the lightskin guy at the entry he doesnt follow the rules never coming back,place,positive
11,3390,nice and cosy place with excellent coffee san sebastian is perfect,place,positive
11,3391,cool place peace neat and clean coffee is also tasty staff is friendly,place,positive
11,3392,cozy place average coffee and sweet,place,positive
12,3393,spanish latte san sebastian cake ac chars service prices medium cleanline parking overall rating vry nice place the only _v thing is smoking smell in non smoking area,place,positive
12,3394,cosy place with inside smoking area and the staff was so friendly and generous,"service, place","positive, positive"
12,3395,the coffee is amazing the place is cozy and comfortable but the service was a,"service, ambience","positive, positive"
12,3396,really comfy place loved them coffee and felt just like home thinks to yara for being super nice,"drinks, place","positive, positive"
12,3397,itheir iled white mocha was grat as well they have a great blendstaff were great and patient as wellvry diverse place,ambience,positive
12,3398,nice place i liked them coffee and yaras service was great ____,service,positive
12,3399,great atmosphere and service,"service, place","positive, positive"
12,3400,the ice tea was great and i love the smoking area space great overall experience ____,"place, staff, food","positive, positive, positive"
12,3401,best coffee _ shop in the area great vibes relaxing good for meetings haas a lounge and thres group games sequence uno jokaroo and chess come with your friends and enjoy the coffee,place,positive
12,3402,the ice teas are nice but is the coffee is below average the atmosphere and service are good,place,positive
12,3403,the best cafe everamazing staff swift service cool deco and comfortable seatinga great local place to chill and unwindim hooked,"place, staff","positive, positive"
12,3404,amazing staff and its a good place to chill i tric a banana bread and it was so delicious and the coffee was flawles __ all the best,place,positive
12,3405,excellent place for gathering in south obhur area,staff,positive
12,3406,my favorite place and a speecal revolution you for yara________,"service, staff","positive, positive"
12,3407,really nice place to gather with friends and family the staff are verry friendly and professionalthe ice spanish latte vry yummi __ the san sebastian so delicious ______,seating,positive
12,3408,if you was a quiet and spacious place with good coffee __ this is the place,place,positive
12,3409,the staff are amazing also they have,"price, food","positive, positive"
12,3410,fast service and friendly staff good coffee tast i recomment the ited tea too,ambience,positive
12,3411,good coffeenice seating plans howver music shoulds be that loud,staff,positive
12,3412,my favorite spot really nice and quiet __,place,positive
12,3413,absolutly economic and taste is delicious,place,positive
12,3414,quite if wanna study or meet,place,positive
12,3415,friendly staff good vibes,"ambience, drinks","positive, positive"
12,3416,amazing place and coffee the best in the area,place,positive
12,3417,the best local cafe,food,positive
12,3418,amazing place and coffee __,food,positive
12,3419,good coffee shop,place,positive
12,3420,nice area like it,food,positive
12,3421,great tast of coffee _,"price, place","positive, positive"
12,3422,good,staff,positive
12,3423,best cafe in neighborhood__,place,positive
12,3424,unbelievable,food,positive
12,3426,the branch is large and an explanation of a sweet time in which a large and internal smoking department and a second small section for meetings and the employee has an upscale morality and once cooperative and may god make him happy great coffee and chicken sandwich is excellent do not miss the orange cake the same as the house and its solution is weighted,"service, ambience","positive, positive"
12,3427,the place is very sweet there are very suitable meeting rooms and offices for study and to work for the weather is very quiet and delicious coffee,staff,positive
12,3428,i took from them a halloum sandwich honestly and shocked from the quality of living not new and two and it was an old toast not like in pictures the right of people the shape of its shape is tidythis is in the middle of the neighborhood it is its prices and its quality,price,positive
12,3429,the car stood up i opened the menu from instagram i saw the cappuccino size m for riyals i walked,"drinks, staff","positive, positive"
12,3430,god bless you the coffee is very delicious i tried the misfortune ice la laiti and ice caramel mcciathe palm is elegant and beautiful decorationsin an air conditioned room for smokers and external sessions in music their service is wonderful,place,positive
12,3431,thank you to employee abdul rahman for his wonderful morals there were no chairs abroad for maintenance and we asked him if he can get us and actually respond to us and we have a table abroad to enjoy the atmosphere thank you very much god is more like him,price,positive
12,3432,flat white as if i was a student of espresso milk asked for milk more than coffee and not that the taste of coffee is not a bit of coffee the price against the bait is considered high stars for gentle scripts and collaborators give them wellness,place,negative
12,3433,wonderful drinks about an experience flat white ice t khoj ice t darf mohito red c the wonderful solution is about an experience sofa tramisu bishoshin and terrible employees in al zat abdullah cell make you coffee an artist frankly,staff,positive
12,3434,a beautiful and comfortable place for me who loves to study raiq and in sessions of smokers and external sessions,staff,positive
12,3435,i am the first visit that was today frankly it is expensive as a breakfast for me but with riyals,place,positive
12,3436,the place is bad and the people who are uncomfortable are comfortable,ambience,positive
12,3438,rigid the truth of their coffee a lime and a special thanks to the employee abdul rahman for his good dealings,staff,positive
12,3439,the place is beautiful hadi my request for a white bag was terrible and modified sandwish halloum the place is clean but the smell of smoke from the intervention of the coffee door i could not sit and take coffee,clean,positive
12,3440,wonderful employees deal with their external sessions in our sweet atmosphere,place,positive
12,3441,they have the most stroke of saint sacket,place,positive
12,3442,i thank the employee abdul rahman for his upscale treatment honesty,price,positive
12,3443,i only passed by the coffee shop it drastically change over timei only orded their espresso single origin from ugandait was slightly fruction medium body and economy affertastebut it wasnt a clean cop and im sure they can do better ______,"drinks, place, staff","positive, positive, positive"
12,3444,clean and good place to hangout and studythey have many edlets which is so amazingthe ited molcha was goodthey have speecal ich tea drink that was ok as welli like,drinks,positive
12,3445,its a nice place they have the best coffee and cake ive ever tasted it was removed by the barista faisal he is very helpful and reserveful,"drinks, place","positive, positive"
12,3446,well educcated barista great coffee and spacethe coffee is highly recommended for people who has work to get donealso prices are fair for the quality and environment ____,"decor, ambience","positive, positive"
12,3447,its a perfect place for workstudy morning eventing they offer a variety of hot cold drinks deserts i enjoyed the flat white and cemex the while atmosphere of the cafe is lovely they have a great tast of musicand the staff are so friendly highly recomment place,place,positive
12,3449,vry nice place i like thems products and the specialized coffee_ __ they got so deicalous sweet ________,staff,positive
12,3450,great settings and decorancs i tric latte and cappuccino baristas are great music isnt loud so you can study or read i love the vibe and you must try,clean,positive
12,3451,this cafe is one of my favorite placeshighly recomment __,place,positive
12,3452,nice contemporary environment with great hospitality from the baristapresentation is fantastic as wellfound a nice spot to work for a few hours which is always a bonus,drinks,positive
12,3453,a very calm and collecated cafe everything is amazing from the selection of coffees that their have available to the seather and most importantly of their staff is the kindest ive interacted with them s goits anazing cafe to study work in,drinks,positive
12,3454,i love the coffeebutwhere i went upstairs i saw a roll of toilet paper on the long table in the middle tissues on the floor plaastic wrappers everywhere and the tables were dirtythe pillows aret in their place so that made me think that the employees dont clean after costumersone of the guys working there was sitting on the count with him leg up which i didnt appryciat at alli work at a restaurant and i know for a fact that is ant how it show bethe dirtins of the place made me feel like they welfting clean their coffee tools eight,drinks,positive
12,3455,really nice cafe with card games,price,positive
12,3456,vry great i love it we were people one got a cortado and i got the iled latte and it was amazing __ and there was the games to play like chess and dominos and lots of more games it was vry fun __ i recommen so ha jakarooif people will to play,service,positive
12,3457,all coffee tys,service,positive
12,3458,good coffee but,drinks,positive
12,3460,great brand development along with perfect service and products,ambience,positive
12,3461,i recomment spanish latte and cortadothe sweets and cake were deliciousthe customer service is good overall the place is very comfortablethefore you can do serous work or studying,"drinks, place","positive, positive"
12,3462,highly recommended best coffee i had ever tasted first visit but wouldnt be the last,staff,positive
12,3463,we orded flat white regular milk sar each flat white coconut milk sar crunchy cake sar the flat white went actulaly that good they were kinda burned and the amount wast even for every cup mine was almost the cup filled the cake was yummy the decor is so simple and cozy good environment for working and studying children are allowed so it is might be enteremely annoying and difficult to focus sometimes,place,positive
12,3464,so cozy and comfortablegreat atmosphere alongside with my fav cupfee bringing my children with me last time thought was not a good idea becuse i kind of got scopeed when they ran around,ambience,positive
12,3465,its a good place and barista khaled is a good man hes maike amazing flat white i like him coffee,"price, place","positive, positive"
12,3466,one of the best cafees in north obhur to study work and chill outthe atmosphere is nice the staff is so friendly also their fact which is so good,"price, place","positive, positive"
12,3467,nice cozy place great staff,drinks,positive
12,3468,i admit this coffee their day so qualified baristas and tasty sweets as well i came regularly in morning which they have a creming atmosphere for working in,"drinks, place","positive, positive"
12,3469,cozy place with great atmosphere and high quickei tried the v honduras and it was fantasticprices are reasons,"drinks, place","positive, positive"
12,3470,the place is cosy but the chairs are not commentablecustomer service is goodcoffee is averagethe price is average sar for a cup of v,drinks,positive
12,3471,best white mocha ever never ordering from any other placebut really need bigger sizes,"service, place","positive, positive"
12,3472,great place love the brownies and cortado also tred the arabic latte whiche was always new and depicwonderful staff __,"place, staff","positive, positive"
12,3473,the best place i have visited before who work there all of them are so fryndly delicious drinks nice dessrts ____,place,positive
12,3474,the ice spanish latt is wonderful it is the best that ve ever tried __,"ambience, place, staff, food","positive, positive, positive, positive"
12,3475,the service is excellentithe place is calm and nice,drinks,positive
12,3476,friendly staffnice serviceclean spacehighly recommentkeep up the good work,staff,positive
12,3477,good coffee chill and quiet place for work and studying,"service, ambience","positive, positive"
12,3478,staff are polite and fastdrinks are yummy and the place is cozy,service,positive
12,3479,great coffeewold comes again to have the v,place,positive
12,3480,amazing staff and cozy environment highly recommended for hang outs or work ____,drinks,positive
12,3481,good coffee great service and hospitality also a very chilled atmosphere and a comfortable sitting area,"service, price, ambience","positive, positive, positive"
12,3482,high quality for drinks stars for customer service __,food,positive
12,3483,theyve such helpful staff and they are kinds a wonderful place where you study ioorder cortado it was tasteful,ambience,positive
12,3484,one of the best coffees i ever tried,"service, place","positive, positive"
12,3485,good service nice vibes average prices,"service, ambience","positive, positive"
12,3486,good,place,positive
12,3487,i did not like the cappccino but the play atmosphere is perfect for working studying,dessert,positive
12,3488,nice place for gatherings coffee is good and yummy honey cake __ excellent service,"service, staff","positive, positive"
12,3490,try the colombian drib ____ nice place n good coffee,place,positive
12,3491,coffee honey cake are perv,seating,positive
12,3492,coffee was really good professional services staff,"service, place","positive, positive"
12,3493,wow,"service, staff","positive, positive"
12,3494,located in the vibrant moja plaza this esteem brand in saudi arabic presents its own unique and delectable section of coffee and swiths,staff,positive
12,3495,great tast as expect loverly decoration and good seather area a good point for obhurr residents,drinks,positive
12,3496,vry nice place and vry good service barns coffee ______,place,positive
12,3497,this is branch is so chautic one staff taking the orders another one is making them people have been waital for toh long,drinks,positive
12,3498,i will have their coffee with to stars becuse its not black actually but the first for the star is becense every time and unp rofssional ways they employees treat and dealwith their customers it feels like them was available to work there i used to blame indivical employes but after so my mess not recommended __,food,positive
12,3499,best ice moca and cappccino,staff,positive
12,3500,one of my best places to drink a coffee __,place,positive
12,3501,the coffee cups ar small yet they still charge sar for each cup,food,positive
12,3502,good,staff,negative
12,3503,suo amazing branch and the staff over there i dont know what i only but everyone are be best ______ exactly the crew in the morning,food,negative
12,3504,good coffee shop but years ago not now cafe with no internet services sheeesh,drinks,positive
12,3505,good,service,negative
12,3506,incredly rude employeesgave me small drink with ice when a a drink that small shoult have this much ice,drinks,positive
12,3507,worst barns branch theres always something wrong with the coffee,drinks,positive
12,3508,good taste best coffee,place,positive
12,3509,the worst service ever have been seen ever,service,positive
12,3510,coffee,staff,positive
12,3511,my favourite coffee,dessert,positive
12,3512,the splendor of the place the coffee and the parista in the kufi thank you for their progress,service,positive
12,3513,the star is for comment only i waited almost minutes but to ask knowing that he was in one customer but in front of me and it is clear that the parista made coffee without the same and the place of coffee is a milligressas for the sessions i leave you comment,place,positive
12,3514,i thank the employee fatima for its good treatment the request is laes latih shot her hand received her the same as what i want __,service,positive
12,3515,barniz is the same miserly in the joke in one stingy he said to his family if you succeed in a pocket for you and when they succeeded their cakes did not have air and he said to them if you succeed again i will make it air for you __ barniz is surrounded by wi fi in the branch but they do not give you its secret number you cannot occupy the lipops on it and the calamity is the name of the guest barns this is one of the strangest things that you go through my life and no one says an individual error of employees because i contacted customer service and told me about one letter officer of the customers experience customer experience in barneez i advise you to submit your resignation from our morals like the generosity of the generosity with everyone and our saudi companies reflects our morals and bernizs politics is completely unlike our morals if this continues i guarantee you you will disappear from the market during the next five years starbucks is away from the branch the right of parnis a minute alone i mean your opponent starbucks is a minute away from the branch and you behave such let us consider it with you as a customer i asked barniz now for riyals and i answer with me a laptop to work and often sit between two to hours i request within two requests to three average students of riyals surprisingly they are forbidden to give me the wi fi number but by barcode and barcode what works on the laptop but the mobile when i saw this thing where i went where is starbuck how much barniz lost now riyals immediately when i got out of the branch and if we say that i work in the week in the cafe days with an average cost of riyals per week and monthly riyals i mean barniz lost from one person its loss is achieved at a rate it lost a week of _ from the customer basket monthly lost _ from the customer basket responsible for the customers experience in barneez hear my advice and give his resignation to see you a second profession,ambience,positive
12,3516,may god be pleased with her,drinks,positive
12,3518,frankly the employee fatima is very respectful and its reception is beautiful for customers and always you will be dominated by my coffee as i love her give her wellness,price,positive
12,3519,the best branch and the most branch in which i feel calm and comfortable,staff,positive
12,3520,i asked for the because of the long shoot white moka ice chicken and i wrote more than once adding extra ice unfortunately the request has reached without any piece of snow and above that it has arrived warm without any cold because it is like usual milk is not cold i am a fan of barnes but more than once i repeat the same behavior milk is not cold unfortunately i began to ask you i hope to read my comment and you will not be surprised as they are marginalized as customers observations,price,positive
12,3521,excellent location beautiful decorations and semi external sessions but unfortunately it does not have milk alternatives very good coffee try turkish coffee with a little sugar ____,staff,positive
12,3522,a good new branch and its prices are still reasonable unlike competitors,staff,positive
12,3523,beautiful kofi i love orchids from them and in some of the big branches meet the authorities and sands the workers are respected,place,positive
12,3524,from the saudi brands that we are proud of specialized coffee competitive prices high quality and more beautiful decor a permanent and distinct choice the truth of the idea of its expansion and the transformation from the hashtags of wonderful coffee stores and i used to say if it is to settle it spread more and more progress and success,staff,positive
12,3525,the employee fatima is a gain for the branch of the northern sails may god be pleased with it,service,positive
12,3526,fateh employee is very nice and cooperative with me she was and explained to me the varieties in a very way that made it easier for me ________,staff,positive
12,3527,this is my favorite branch for barnes there are internal sessions and external sessions we took turkish coffee,dessert,positive
12,3528,excellent service and suggestions of an artist from the employee fatima al sharif thank you and for each employee who is dedicated to his work and appreciates the customer and understands his requirements _ _,service,negative
12,3529,miss fatima performs a great service good handling and tact with customerswe thank you for choosing it and more progress god willing,staff,positive
12,3530,about his experience the best taste of turkish coffee can be tasted frankly in barnez i would like to thank the employees in the branch very much their treatment is sophisticated and distinctive i hope that the tables and outer chairs for the branch are improved,"staff, location","positive, positive"
12,3531,the well known does not know the branch is beautiful and its decoration opens the soul and has a shokukranchy cake,staff,positive
12,3532,i asked for the aplayn and your form soweto the request before the delegate arrived in a long time a cold one the cream is not present and even the powder chocolate to the face unfortunately there is no professional,place,positive
12,3533,there is no discussion in the quality of barnez and for the employee fatima one of the best employees and their goodness god willing his servants and may god grant her success lord,service,positive
12,3534,i have been able to visit your site in the northern sails several times and the best dealing with the employee fatima from what encouraged me to sustained this branch thank you and thank you for the good meeting and dealing,"service, place","positive, positive"
12,3535,my methods are from your customers the northern obhur branch in the past the branch was on one employee,staff,positive
12,3537,workers in the barniz branch north of abhar al sharaa neighborhood are very wonderful dealing and serving it ____,staff,positive
12,3538,i love turkish coffee and the bashushin employees like the place like the employee fatima asal and its service is beautiful,service,positive
12,3539,i thank the employee fatima for the good handling and the wonderful smile from the best and most wonderful female employees _ _ _ ___,place,positive
12,3540,dealing for you,food,positive
12,3541,everything is a hero except for the presence of only one employee and the requests are late because of that,place,positive
12,3542,the employee fatima is very polite and her treatment is sweet __,"place, staff","positive, positive"
12,3543,a very branch and there is no interest in the addition and all the tables have an empty marsh,"ambience, place","positive, positive"
12,3544,good,"drinks, place","positive, positive"
13,3545,great placeworkers are so kind,ambience,negative
13,3546,cozyneatvry friendly staffgreat place for watching football matches and enjoying ps gaming timeindooroutdooorwifinice sandwiches and cakes,drinks,positive
13,3547,best cafe and decent people,place,positive
13,3548,went to the place one time and welf like to be thre daily the coffee sweets and the entertainment stuff are all good,place,positive
13,3550,the french coffee was exactly as it shift be,food,positive
13,3551,one of best cozy places in jeddah if youre nearby i advise you to visit good luck,place,positive
13,3552,lovely place cozy and perfect coffee,food,positive
13,3553,grit,ambience,positive
13,3554,nice quite remables,ambience,positive
13,3555,fabulous place i like it,service,positive
13,3556,nice and healthy drinks,ambience,positive
13,3557,amazing environment with coffee,food,positive
13,3558,new cafe in modern style,service,positive
13,3559,nice __,place,positive
13,3560,fantastic design to relax,place,positive
13,3561,best in town,place,positive
13,3562,nice,ambience,positive
13,3563,my hangout place,place,positive
13,3564,good place,price,positive
13,3565,nice place,ambience,positive
13,3566,relax time,price,positive
13,3567,nice place,drinks,positive
13,3568,a sweet coffee and a calm atmosphere a quiet atmosphere the service is good their prices are medium and their honey is clean and the luxurious flavor but they need to care more about the shisha and good luck to them,views,positive
13,3569,sweet and calm atmosphere young people are good cheerful and smiling face,service,positive
13,3570,his sessions are wonderful new distinctive and eating is good and cheap but in many varieties it is not availablepossible child plays a golf with,clean,positive
13,3571,god willing a sweet session coffee and a weighted solution __,clean,positive
13,3572,a wonderful cafe to watch the matches have many options,place,positive
13,3573,jamil hadi caf comfortable sessions and high end services i wish you the best,place,positive
13,3574,the best sufficient in dealing cleaning and honey is very excellent i congratulate the owner of al kafi on his choice of the employees ____,"price, place","positive, positive"
13,3575,a summit in ethics employee mohamed abu youssef and literature in dealing with the customer thank you for the cleanliness and good reception,staff,positive
13,3576,a sweet place characterized by turkish and honey coffee,place,positive
