Store_locations_ID,Text_ID,Text,aspectCategory,sentiment
6,1711,tried the flat white and ice caramel maccato and they were all delicious,"place, location","positive, positive"
6,1712,alqahtani station in alrawabi neighborhood on the highway opened with a new model and a new shape and it has a rental kiosk i hope to open a store for you there south of jeddah,drinks,positive
6,1713,excellent but one time i was handed premade cold coffee,drinks,positive
6,1714,the best coffee,"ambience, food","positive, positive"
6,1715,a story that has not yet begun,service,negative
6,1716,unfortunately i took the ice chocolate warm and added ice which was very very bad,drinks,positive
6,1717,the coffee was a little cold i got a nice flat white,staff,positive
6,1718,the staff is great and their coffee is delicious,food,positive
6,1720,excellent once,drinks,positive
6,1721,ice spanish double shot,food,positive
6,1722,very far,service,negative
6,1723,bad treatment,food,positive
6,1724,excellent and delicious especially the cookies and cortados,drinks,positive
6,1726,cortado only,drinks,positive
6,1727,ice latte with caramel syrup,price,positive
6,1728,great latte very reasonable prices energetic guys god willing,price,positive
6,1729,i asked for a cappuccino he gave me a large cup i told him this is a cappuccino and he said yes i made it big and double the account said riyals and as you see on the menu there is no cappuccino for riyals i did not ask for that or just to bring in the most money possible like some restaurants that place a large size without asking the customer the coffee is very ordinary and he did not give me sugar a spoon or anything to whomever i told him why do you do such and such he says this standard is our right so big and double i mean you write and riyals in the menu and for whoever buys the customer you charge him riyals,drinks,positive
6,1730,ice americano and ice petaccio are amazing,drinks,positive
6,1731,his coffee is perfectly balanced,price,positive
6,1732,a very excellent experience and very good prices i ordered a flat white and it had a bitter taste i give it a,drinks,positive
6,1733,very delicious god willinghot chocolatecold white mocha and the most amazing,drinks,positive
6,1734,excellent cold drinks,service,positive
6,1735,the coffee is delicious but the service is slow,staff,positive
6,1736,thank you very much to the saudi youth working there yes morals and yes reception,drinks,positive
6,1737,i wish they would add other types of milk,staff,positive
6,1738,car service cafe he was truly distinguished and unique in his idea the cafes decor is beautiful and simple the caf features cold drinks like spanish latte and their prices are good the staff is friendly,drinks,positive
6,1739,one of the most wonderful types of coffee prepared using the highest quality coffee beans used with a delicious taste,service,positive
6,1740,cold spanish is a beautiful thing with them and the most beautiful thing is their wonderful treatment,drinks,positive
6,1741,his coffee is delicious,"ambience, food","positive, positive"
6,1742,a story i cant tell,food,negative
6,1743,cortado is not a mistake,drinks,positive
6,1744,very much appreciated every day i have to order and buy a spanish latte from him,drinks,positive
6,1745,an excellent brand and identity that is competitive in the large world of beverages,"price, drinks","positive, positive"
6,1746,i ordered a spicy rose latte from them and to be honest i did not like the rose flavor the first time i tried it it tastes the same as rose water and the price is very suitable for the size,staff,positive
6,1747,i ordered the caramel ice shake beautiful the store looks and is nicely decorated and the cashier is nice,price,negative
6,1748,prices are exaggerated why is the name effrench has the arabic language no longer had a name with the same meaning indeed it is a farce for the halfeducated,price,positive
6,1749,the best caf kiosk in north obhur i tried the spanish latte and the white mocha they are great and their prices are good the young people are very helpful cheerful and artistic may god make them happy bless them and grant them success dont miss it,service,positive
6,1750,what will make me visit them again is their sweet psychology and sweet morals,drinks,positive
6,1751,their coffee is good but the ones they work with are two aerators,ambience,positive
6,1752,excellent and a good competitor to the rest,place,positive
6,1753,the coffee is excellent once and my favorite coffee place now,ambience,positive
6,1754,i advise everyone to visit this coffee shop especially those in the barsta sailing plan there is an artist and his creation is amazing,drinks,positive
6,1755,excellent coffee,price,positive
6,1756,in my opinion the coffee is excellent i had a cold spanish latte awesome and good prices i will come back again soon young people are cooperative and two pills the store has demand and traffic even though it is in a vacant area i loved it,"price, drinks","positive, positive"
6,1757,everything they have is delicious what they do is amazing mashallah they are artists their coffee is excellent they nail it their manners and taste will make you repeat the visit may god reward them well i once liked the caf it has the best coffee in jeddah and its prices are excellent,ambience,positive
6,1758,where is the second branch entitled not sailing far,service,positive
6,1759,spanish latte has an artist i expect more success for them,price,positive
7,1760,to be honest it is wonderful and its price is acceptable compared to others and it has loyalty discounts thanks to them,drinks,positive
7,1761,distinctive coffee flavour,drinks,positive
7,1762,cappuccino wins thank you from the heart,service,positive
7,1763,excellent after barneys in my eyes,drinks,positive
7,1764,one of the most delicious cafes i have tried  every time i take a drink it is tastier than the one before i tried the chicken white mocha espresso hot net died hot and cold spanish latte and the last thing is that employee mujahid may god make him happy served me a flat white with spanish latte  the drink really came to my head mujahid is always honest and a very good employee  thank god that this branch is on my work route  i hope he doesnt go to another branch,service,positive
7,1765,their delay is unnatural they must find a solution,drinks,positive
7,1766,exactly every time and the coffee taste is clear ice white mocha trrrrrrrrrr,"service, staff","positive, positive"
7,1767,mashallah good manners and delicious coffee  the employees name is abdullah,drinks,positive
7,1768,the irresistible taste of coffee,staff,positive
7,1769,i thank the barista mohamed for the coffee he made for me,staff,positive
7,1770,thank you for the good reception and thank you to the employee mujahid the coffee was the best from the employee mujahid,drinks,positive
7,1771,excellent miacchiato,staff,negative
7,1772,ice drop has an artist especially employee khaled,staff,positive
7,1774,what is your instagram account,drinks,positive
7,1775,coffee on the brain,drinks,positive
7,1777,oh god i love spanish iced latte for me the employee is a honey and has a sweet soul,staff,positive
7,1779,excellent,service,positive
7,1780,thank you khaled for the wonderful service and thank you very much for the coffee,clean,positive
7,1781,may god make him happy o lord khaled is a respectable and beloved young man may god give him health and wellness thank you,staff,positive
7,1782,their ice drip is excellent thank you to the employee khaled for his treatment,staff,positive
7,1783,to be honest the coffee is very nice and balanced frankly thanks to the barista khaled for his good manners and treatment,food,positive
7,1784,honestly its an amazing experience and every two days after i take something from them everything wins,service,positive
7,1785,khaled and abdullah my lord are the best baristas in u cafe with good manners and style may god grant them good health,"service, staff","positive, positive"
7,1786,god willing fast service and their coffee is in a good mood the employee is respectful and treats him well may god bless him the employee and barista are khaled,food,positive
7,1787,the taste of coffee and muffin cake is delicious,staff,positive
7,1788,i serve ice chicken white mocha god willing those who know the order are fine i thank the employee khaled,place,positive
7,1789,god willing a successful branch with the employee khaled a special person in a special place,staff,positive
7,1790,with sincere thanks to the employee in the branch for his good treatment,drinks,positive
7,1791,presta khaled spanish latte bitters are delicious,staff,positive
7,1792,may god make the good employee khaled happy with the tastiest americano his coffee is approved,service,positive
7,1794,khaled,drinks,positive
7,1795,cold brew is sweet give khaled a promotion,drinks,positive
7,1796,the best coffee you get from khaleds hand,"service, staff","positive, positive"
7,1797,the quality of coffee and service couldnt be better and thanks to the employees ethics khaled makes your day in a respectful and elegant manner,drinks,positive
7,1798,the drink is any drink khaled is creative and honey is not short,food,positive
7,1799,try the classic ice chicken from employee khaled,"service, staff","positive, positive"
7,1800,one of the best coffees truly the mood the service the dealings and the speed of preparation thank you to the employee khaled for his kind spirit and smile good luck,service,positive
7,1801,the best mechato from prince khaled i wish you success,"service, staff","positive, positive"
7,1802,i ordered a cold brew and the employee at khaled was extremely polite and his service was excellent i wish everyone was like him,drinks,positive
7,1803,to be honest their coffee is very delicious and balanced i tried their cold and hot spanish latte they are all delicious i thank brother khaled for his style and delicious coffee,place,positive
7,1804,i thank ucafe company for appointing the employee mujahid ahmed to the right place his treatment was classy and beautiful and his service was beyond wonderful and beautiful he is a beautiful cheerful and cheerful person may god have many more like him,price,positive
7,1805,fast excellent manners very nice coffee and a reasonable price for a latte of,drinks,positive
7,1806,thank you my dearest ahmed for the most delicious espresso every day,"service, drinks","positive, positive"
7,1807,i went to that branch and had coffee with legendary honesty thank you mujahid for your creativity and sweet style may god make you happy lord and god willing i will come back again for you honey,staff,positive
7,1808,the coffee is very tasty thank you to the employee mujahid i hope his name is he dealt with more than wonderful and i wish you success,"service, staff","positive, positive"
7,1809,i swear to god it is one of the best branches in terms of taste service and staff ethics especially mujahid thank god may god grant them good health they will make you happy with their words in the morning,food,positive
7,1810,tasty,staff,positive
7,1811,i thank the employee mujahid for his high morals his beautiful smile in front of customers and his good treatment,"service, drinks","positive, positive"
7,1812,the coffee is very beautiful brother mujahids style is very beautiful and polite good luck,food,positive
7,1813,the most delicious spanish latte,staff,positive
7,1814,thank you to employee mujahid for the good treatment,staff,positive
7,1815,i thank employee mujahid for his good treatment,staff,positive
7,1816,employee mujahid may god grant him good health for his courteous treatment and the drink was very bitter,staff,positive
7,1817,congratulations to the employee ahmed abdel rahman the best employee i have ever seen in a cafe and thank you for your products,service,positive
7,1818,i thank my brother ahmed hisham for his kind smile and sophisticated treatment,"drinks, staff","positive, positive"
7,1819,the best coffee that puts you in the mood  may god give wellness to the employee mujahid ahmed,staff,positive
7,1820,cold brew and ice drip are a must every day i thank employee mujahid for his high morals,staff,positive
7,1821,the employees style and behavior is very nice,staff,positive
7,1822,frankly speaking the coffee is very nice and the employee mujahid is a very polite respectful and kind person i swear out of he loves you in coffee to the point that i only come to the branch this is me,"drinks, staff","positive, positive"
7,1823,every day my coffee is from u coffee their coffee is unique and very beautiful one of the best employees and baristas who make coffee arbaeen branch tahlia intersection mujahid ahmed and abdullah and alfayhaa branch mohannad and i still dont know which branch may god bless you all,staff,positive
7,1824,the barista is professional and the coffee is excellent,staff,positive
7,1825,peace be upon you i thank you and envy you at the same time for the good employee ahmed abdel rahman his peak in morals dealings and politeness is a gain for you and his style is a reason to visit me which i think about every time,"drinks, staff","positive, positive"
7,1826,their coffee is exact  and every time has the same taste and quality ice white mocha i now prefer to order it from them the coffee taste is clear and balanced the employee in this branch may god give him good health is respectful cheerful and manages the coffee good luck sir,staff,positive
7,1827,respect his employees and their ethics and the beauty of their coffee,"service, staff","positive, positive"
7,1828,the employee ahmed abdel rahman is competent and his choice is tasteful and makes you feel professional service,staff,positive
7,1829,by god almighty i love this cafe and the morning employee i think ahmed is cooperative and his words are sophisticated and polite and on top of that he makes a cortado in the brain,"service, staff","positive, positive"
7,1830,the barista doesnt listen,"drinks, food","positive, positive"
7,1831,ice shaken and cappuccino and there is nothing wrong with the head,price,positive
7,1832,it was in the morning and i was looking for any light coffee that i was craving for i found enough coffee on my way and said lets try it honestly it was the best experience i had from them i had ice drip coffee and a raspberry muffin the coffee was amazing and its price was excellent approximately riyals and the muffin mashallah was large and delicious with no smell eggs or flour taste was my first experience and it was really successful,service,positive
7,1834,thanks for the coffee,service,positive
7,1835,the utmost beauty and everything is authentic thanks for the good hospitality,location,positive
7,1836,a popular location for serving sudanese snacks and coffee,ambience,negative
7,1837,guys fear god it has caused unnatural crowding cars aaaaaaaaaaaaaaaaaaaaaaaaaaa what traffic is this,"drinks, place","positive, positive"
7,1838,a place i recommend visiting for hot sudanese drinks,service,positive
7,1839,of course it is a sudanese store and everything is beautiful and the people are nicer this is what is important,location,negative
7,1840,too bad customers are blocking the roads and this is causing car congestion,price,positive
7,1841,one of the places that brings you back to me is the atmosphere of sudan their coffee is excellent the guys are respectful and their prices are affordable,food,positive
7,1842,sudanese coffee tea and some popular sudanese food the coffee cheese is good,drinks,positive
7,1843,the most beautiful coffee in the world brewed,"drinks, food","positive, positive"
7,1845,alsafa district almamsha,drinks,positive
7,1846,god bless coffee and your mood,drinks,positive
7,1848,sudanese restaurant and perfumery,drinks,positive
7,1849,the best sudanese coffee,ambience,positive
7,1852,dear sudanese brothers,drinks,positive
7,1853,regular popular coffee dedicated to sudanese coffee,ambience,positive
7,1854,unsuitable,drinks,negative
7,1855,samotic coffee i swear,drinks,positive
7,1856,the coffee is excellent,drinks,positive
7,1857,their coffee has a different taste,drinks,positive
7,1858,the best coffee hibiscus milk tea and luqaimat,food,positive
7,1860,magnificence,service,positive
7,1861,dear friends may god make you happy,drinks,positive
7,1862,coffee riyals,service,negative
7,1863,harassment,service,positive
7,1864,deserted,place,positive
7,1865,the movement of our family and loved ones the people of sudan to this region,service,positive
7,1866,the restaurant is very very beautiful and the workers there are of course the finest,drinks,positive
7,1867,coffee refreshes the soul,ambience,positive
7,1868,very beautiful,service,positive
7,1870,i highly recommend hibiscus,place,negative
7,1871,dirty place and lack of attention to cleanliness,service,positive
7,1872,god willing may god bless you everything is good with them and their treatment is sophisticated and excellent may god bless them and grant them abundant grace,drinks,positive
7,1873,sudanese coffee,food,positive
7,1874,enjoy all the sudanese food and drinks in this place,clean,positive
7,1875,the coffee is excellent please pay more attention to cleanliness,ambience,positive
7,1876,the beans tea and sudanese cheese are excellent as for the crowding and noise inside and outside i hope they take into consideration the customers and neighbors,food,negative
7,1877,hibiscus juice is very dangerous,clean,positive
7,1878,a sudanese asylum officer a clean shop and respectable people more success,ambience,positive
7,1879,there are no words about the coffee shop next to it a restaurant and a perfume shop,food,positive
7,1880,what i liked most about coffee god bless you when you visit the store you will find most of the products that every sudanese home needs including food and drinks and fish and fillet,place,positive
7,1881,the coffee is excellent and the place is clean,place,positive
7,1882,a place of greatness upon greatness,place,positive
7,1883,beautiful place just needs more attention to cleanliness but overall a comfortable place and a nice atmosphere,place,positive
7,1884,beautiful sudanese gathering we ask god to protect the country,ambience,positive
7,1885,beautiful,drinks,positive
7,1886,beautiful sudanese coffee that controls the brain,ambience,positive
7,1888,excellent,food,positive
7,1889,all news and news here,place,positive
7,1890,a meeting place to relieve oneself from the burden of work and work schedules they are all excellent especially alhadi an excellent man brother brothers i wish you all success,drinks,positive
7,1891,the best sudanese coffee you can drink in your life,food,negative
7,1892,honestly its very bad,food,positive
7,1893,delicious,food,positive
7,1895,excellent,drinks,positive
7,1896,every day i go and drink coffee from there times god,place,positive
7,1897,for all sudanese purposes,food,positive
7,1900,the caf is excellent the service is very good the restaurant is good and the herbal shop has most of your needsthe problem is that some of our sudanese brothers sit in the walkway and the road thus they cause dirt on the sidewalk and inconvenience passersby and left empty bags coffee and tea cups along the road next to the caf i hope to make them aware so that the stores are not closed thank you,clean,positive
7,1901,untidy not beautiful and extremely dirty,staff,positive
7,1902,guys there is nothing to say about them,food,positive
7,1903,all sudanese items are available god willing,drinks,positive
7,1904,the most beautiful sudanese coffee,food,positive
7,1905,good,food,positive
7,1906,good,place,positive
7,1907,nice place and amazing coffee,place,positive
7,1908,the place is an excellent meeting place for sudanese brothers in jeddah,service,positive
7,1909,the cleanest sudanese coffee i have ever seen in jeddah,service,positive
7,1910,we ask god for success and success,food,positive
7,1911,sudanese products are available,ambience,positive
7,1913,alnilin coffee alsudan restaurant and aljumhuriya apothecary in the alsafa neighborhood have sudanese food and coffee and there are various types of sudanese products in the apothecary from wickeh dukwa dowaim cheese braided cheese fesikh and everything but the parking here is bad and some of our brothers sat on the sidewalk creating an uncivilized view especially since it is a walkway and an outlet for each other the people,place,positive
7,1914,all sudanese purposes present,food,positive
7,1915,the most delicious sudanese dishes,place,negative
7,1916,a barbaric place and those sitting on the road and around the restaurant are harassing passersby harming gods creation and gloating about this and that this problem must be solved it is not good for the sudanese to unite,drinks,negative
7,1917,sudanese brothers gathered with mixed coffee and nothing was better,drinks,positive
7,1918,coffee on the go,food,positive
7,1919,great taste,service,positive
7,1921,excellent,clean,positive
7,1922,clean work and everything you need,food,positive
7,1925,sweet,service,positive
7,1926,the only store that makes you feel like you are in sudan,food,positive
7,1927,good,ambience,positive
7,1929,the most beautiful people i swear they are sudanese and their people and crazy coffee are crazy,place,positive
7,1930,a beautiful meeting place for the sudanese community and shops selling sudanese products,drinks,positive
7,1931,all,drinks,positive
7,1932,sudanese coffee,drinks,positive
7,1933,sudanese coffee how are you,service,positive
7,1934,oh peace i swear to god the best sudanese coffee is in you jeddah prince majid street with the intersection of altahlia majra alsail street,drinks,negative
7,1935,may allah help,place,positive
7,1936,red tea with spices is nothing better but the coffee is a little heavy and bitter,place,positive
7,1937,the best place that serves sudanese coffee in jeddah next to it is alkhartoum restaurant which also features popular sudanese food and alnilin perfumery for selling sudanese spices and products the location is great the only problem is overcrowding,"price, ambience, place","positive, positive, positive"
7,1938,sweet and wonderful sudanese coffee but the place is bad get your coffee and walk,drinks,positive
7,1939,a suitable place for a beautiful popular atmosphere and drinks are cheap and cheap,"ambience, place","positive, positive"
7,1941,it is a beautiful hole it needs some organization,drinks,positive
7,1942,i do not recommend it at all,service,positive
7,1943,the best coffee in jeddah,service,positive
7,1944,my very own,drinks,positive
7,1948,excellent,food,positive
7,1949,yes,ambience,positive
7,1950,i loved it,"drinks, place","positive, positive"
7,1951,excellent bites,drinks,positive
7,1952,it belongs to the sudanese community and is popular for those who love popular songs,place,positive
7,1954,crazy coffee greetings to our wonderful brother basha,"decor, ambience","positive, positive"
7,1955,the place is not well equipped and it specializes in catering to the sudanese community,food,positive
7,1956,excellent,"ambience, food","positive, positive"
7,1957,a promising start we need organization and simple decorations that reflect the reality of sudan,place,negative
7,1959,a unique experience,service,positive
7,1960,the place is crowded cramped and noisy,food,positive
7,1961,god willing god bless i have friday and saturday every day,service,positive
7,1962,excellent and fast service,service,positive
7,1964,the car service experience was good my order was an americano coffee but the coffee was not very hot but it was somewhat acceptable,place,positive
7,1965,god willing may the most gracious be blessed good luck lord,drinks,positive
7,1966,black coffee is very nice and balanced with no acidity or bitterness the store often serves the drivethru and there is no special parking for the car if you want to go inside the store the croissants are excellent the donuts are good,price,negative
7,1967,the day is complete with them,"service, price","positive, positive"
7,1968,tim hortons is one of the most beautiful coffee shops from which you can drink coffee that you will enjoy this is from experience not general talk but from the reality of experience with this coffee and others,place,negative
7,1969,expensive in vain,place,positive
7,1970,from your customers from the first day you opened in saudi arabia you said an offer for a riyal and the beginning of the year may god bless you but i come and order two cups from the car orders he tells me a variety every customer has a cup i asked him okay lets cook two at home he says sorry the companys system unfortunately you failed good luck,food,positive
7,1971,frankly speaking it is a shock from a large company like you and i am a daily customer i come at am and get to the place and the drivethru is closed and the worker inside tells me to come with your foot through the window and he goes to talk to me from behind the grille and the window closes in my face as if i had turned away from them and the excuse is that he is working alone so the shop is closed and from outside the shop everything is closed he is frankly shocked that this is his last visit and dealing with you,clean,negative
7,1972,the place is excellent quiet and the service is excellent the only drawback is that the shop is small,staff,negative
7,1973,better than sta,price,positive
7,1974,in some branches i doubt the cleanliness of the worker of arab nationality in western saudi arabia,food,positive
7,1975,bad treatment by the employee as a delivery representative and he refused to deliver the order because i asked him to speak in a decent manner,food,positive
7,1976,their offers with payment by sabb bank card are excellent,drinks,negative
7,1977,they have delicious stuff,ambience,positive
7,1978,good,"place, food","positive, positive"
